date,climate_sentence_count,climate_sentences
1982-06-09,14,"Our method has been to organize our defensive capabilities, both nuclear and conventional, so that an aggressor could have no hope of military victory."
1982-06-09,14,There is a danger that any conflict could escalate to a nuclear war.
1982-06-09,14,Strong conventional forces can make the danger of conventional or nuclear conflict more remote.
1982-06-09,14,"The more we close the conventional gap, the less the risks of aggression or nuclear conflict."
1982-06-09,14,"Your Bundeswehr is a model for the integration of defense needs with a democratic way of life, and you have not shrunk from the heavy responsibility of accepting the nuclear forces necessary for deterrence."
1982-06-09,14,"In recent months, both in your country and mine, there has been renewed public concern about the threat of nuclear war and the arms buildup."
1982-06-09,14,"If I might quote Heine again, he almost foretold the fears of nuclear war when he wrote, ""Wild, dark times are rumbling toward us, and the prophet who wishes to write a new apocalypse will have to invent entirely new beasts, and beasts so terrible that the ancient animal symbols will seem like cooing doves and cupids in comparison."" The nuclear threat is a terrible beast."
1982-06-09,14,Perhaps the banner carried in one of the nuclear demonstrations here in Germany said it best.
1982-06-09,14,It is only by Comparison with a nuclear war that the suffering caused by conventional war seems a lesser evil.
1982-06-09,14,I would remind them that it is the United States that has proposed to ban land-based intermediate-range nuclear missiles-the missiles most threatening to Europe.
1982-06-09,14,One element calls for reducing land-based intermediate-range nuclear missiles to zero on each side.
1982-06-09,14,We will move ahead with our preparations to modernize our nuclear forces in Europe.
1982-06-09,14,"But, again, we also will work unceasingly to gain acceptance in Geneva of our proposal to ban land-based, intermediate-range nuclear missiles."
1982-06-09,14,"In the United States, we will move forward with the plans I announced last year to modernize our strategic nuclear forces, which play so vital a role in maintaining peace by deterring war."
2022-03-01,7, And we’ll do it all to withstand the devastating effects of the climate crisis and promote environmental justice.
2022-03-01,7, And we’ll do it all to withstand the devastating effects of the climate crisis and promote environmental justice.
2022-03-01,7," We’ll build a national network of 500,000 electric vehicle charging stations, begin to replace poisonous lead pipes—so every child—and every American—has clean water to drink at home and at school, provide affordable high-speed internet for every American—urban, suburban, rural, and tribal communities."
2022-03-01,7, Second—cut energy costs for families an average of $500 a year by combatting climate change.
2022-03-01,7,"  Let’s provide investments and tax credits to weatherize your homes and businesses to be energy efficient and you get a tax credit;   Double America’s clean energy production in solar, wind, and so much more;   Lower the price of electric vehicles, saving you another $80 a month because you’ll never have to pay at the gas pump again."
2022-03-01,7,"  Let’s provide investments and tax credits to weatherize your homes and businesses to be energy efficient and you get a tax credit;   Double America’s clean energy production in solar, wind, and so much more;   Lower the price of electric vehicles, saving you another $80 a month because you’ll never have to pay at the gas pump again."
2022-03-01,7,"  Let’s provide investments and tax credits to weatherize your homes and businesses to be energy efficient and you get a tax credit;   Double America’s clean energy production in solar, wind, and so much more;   Lower the price of electric vehicles, saving you another $80 a month because you’ll never have to pay at the gas pump again."
1983-09-05,1,Ambassador Nitze has returned to Geneva to resume the negotiations on intermediate-range nuclear weapons in Europe.
2020-03-13,6,Walgreens.
2020-03-13,6,"CORNELL: Well, Mr. President, thank you for inviting us here today, along with our colleagues from Walmart and Walgreens and our partners at CVS."
2020-03-13,6,"In the near term, we’re all committed to making sure we’re keeping our stores open to serve the American consumer who is rapidly stocking up on household essentials, key food and beverage items that they need during this time; making sure we run safe stores; and creating an environment that’s safe for our team members, making sure that they feel supported during this very critical time."
2020-03-13,6,"Mr. President, I want to join you in thanking Walmart and CVS and Target and Walgreen."
2020-03-13,6,"For the areas where the virus is spreading, the CDC is advising communities to postpone large gatherings, postpone assemblies, social functions, and sporting events; stagger recess and lunch for schools that aren’t canceled; limit in-person meetings; increase scheduled cleanings; and cancel work-sponsored travel—among numerous other steps that can be taken."
2020-03-13,6,"Yeah, specifically the areas where we’re seeing pressure in the supply chain are surface cleaners, cleaning supplies, paper goods, in particular."
1991-01-16,2,We are determined to knock out Saddam Hussein's nuclear bomb potential.
1991-01-16,2," While the world waited, Saddam sought to add to the chemical weapons arsenal he now possesses, an infinitely more dangerous weapon of mass destruction—a nuclear weapon."
2018-02-15,0,
2016-05-15,15," (Applause.)     This is a place where you 3D-print prosthetic hands for children, and devise rooftop wind arrays that can power entire office buildings with clean, renewable energy."
2016-05-15,15," (Applause.)     This is a place where you 3D-print prosthetic hands for children, and devise rooftop wind arrays that can power entire office buildings with clean, renewable energy."
2016-05-15,15," (Applause.)     This is a place where you 3D-print prosthetic hands for children, and devise rooftop wind arrays that can power entire office buildings with clean, renewable energy."
2016-05-15,15, You’re more environmentally conscious.
2016-05-15,15, We’ve doubled the production of clean energy.
2016-05-15,15," The answer is to do trade the right way, by negotiating with other countries so that they raise their labor standards and their environmental standards; and we make sure they don’t impose unfair tariffs on American goods or steal American intellectual property."
2016-05-15,15," It calls to mind the words of Carl Sagan, who graduated high school here in New Jersey -- (applause) -- he said:  “We can judge our progress by the courage of our questions and the depths of our answers, our willingness to embrace what is true rather than what feels good.”  The debate around climate change is a perfect example of this."
2016-05-15,15, (Laughter.)  (The wind starts blowing hard.)  (Laughter.)   But think about the climate change issue.
2016-05-15,15, (Laughter.)  (The wind starts blowing hard.)  (Laughter.)   But think about the climate change issue.
2016-05-15,15," Every day, there are officials in high office with responsibilities who mock the overwhelming consensus of the world’s scientists that human activities and the release of carbon dioxide and methane and other substances are altering our climate in profound and dangerous ways."
2016-05-15,15," Every day, there are officials in high office with responsibilities who mock the overwhelming consensus of the world’s scientists that human activities and the release of carbon dioxide and methane and other substances are altering our climate in profound and dangerous ways."
2016-05-15,15," (Laughter.)  I mean, listen, climate change is not something subject to political spin."
2016-05-15,15," (Applause.)  If we don’t act, if we don't follow through on the progress we made in Paris, the progress we've been making here at home, your generation will feel the brunt of this catastrophe."
2016-05-15,15," I am suggesting that those highest expressions of our humanity can only flourish when our economy functions well, and proposed budgets add up, and our environment is protected."
2016-05-15,15, That's how we cleaned up our air and our water.
2009-01-15,1,America's air and water and lands are measurably cleaner.
2009-09-09,2,But we did not come here just to clean up crises.
2009-09-09,2,"Finally, our health care system is placing an unsustainable burden on taxpayers."
2015-06-26,0,
1991-07-31,42,This is a different time; different winds are blowing.
1991-07-31,42,And we consider that it is in a decisive stage and we should not -- and here I want to use what our ministers use -- to have a window of opportunity in order to really achieve progress in this very sensitive area of international politics.
1991-07-31,42,"The President and I talked about the situation in Europe in the context of implementing the agreement -- the Helsinki Agreement, the Paris Charter, and especially with regard to the processes taking place in that region, and specifically noted the situation in Yugoslavia, and expressed our position, our understanding, our approach to the resolution of this issue -- a very serious one which worries many of us."
1991-07-31,42,"We're going forward with space cooperation, cooperation in the environment."
1991-07-31,42,We emphasized the necessity of having all sides respect the basic principles indicated in the Helsinki Act and the Paris Charter.
1991-07-31,42,"So, quite a bit has happened between us since Paris."
1991-07-31,42,"I would ask both of you to think back to the 1986 Reykjavik summit when Ronald Reagan horrified quite a few American nuclear experts and almost all of the European leaders by giving serious consideration to your proposal, President Gorbachev, for a ban on all nuclear weapons."
1991-07-31,42,"In the end, Reagan said no because of the belief that nuclear deterrence has, in fact, kept the peace."
1991-07-31,42,Why now are the two of you not saying we will now work towards a total nuclear ban?
1991-07-31,42,Do you still believe in the efficacy of nuclear deterrence in keeping the peace?
1991-07-31,42,"Particularly, sir, I ask you, President Bush, given the fact that some of these breakaway Republics, they have nuclear weapons in there and who knows what would happen if they declare independence."
1991-07-31,42,"The very fact that -- I wouldn't suggest that a breakaway Republic is going to use a nuclear weapon against the United States, but I would suggest that we have every reason in the world to be concerned about renegades -- not in these areas, perhaps; I hope not -- getting hold of nuclear weapons."
1991-07-31,42,"But in my view, other countries do possess nuclear weapons."
1991-07-31,42,The only thing at risk is an errant nuclear missile aiming at a country.
1991-07-31,42,"I think that the argument which you want to ascribe to me, that in my policy I looked upon nuclear weapons as an element of deterrence, is not true."
1991-07-31,42,"We have mapped out a few things for the future, and then there will probably also be questions put to all members of the nuclear club, and they also have to think about what to do with nuclear weapons in the future."
1991-07-31,42,"And finally, we must very carefully act about having the mechanism which we have created and which seems has worked -- but apparently not effectively enough -- about nonproliferation of nuclear weapons."
1991-07-31,42,"For if certain countries will lower their arms and disarm and head in the direction of a nonnuclear world, and at the same time, others will find ways to develop the process in order to have their own nuclear weapons, then we will have a situation which is absurd."
1991-07-31,42,"So, in continuing to support nuclear disarmament and within the framework of the negotiation process, which we have, we have agreed to continue this."
1991-07-31,42,We have the question of truly improving the mechanism of nonproliferation nuclear technology in order -- missile technology -- in order to create an unsurmountable barrier in this area.
1991-07-31,42,"Now I would say the following: We must, within the framework of the documents, the general path mapped out in the Helsinki and the Paris agreements, act in such a way that the old institutions be transformed in the interest of a new Europe so that they serve the interest of a single economic territory, a single security of Europe, a legal aspect."
1991-07-31,42,This is a different time; different winds are blowing.
1991-07-31,42,And we consider that it is in a decisive stage and we should not -- and here I want to use what our ministers use -- to have a window of opportunity in order to really achieve progress in this very sensitive area of international politics.
1991-07-31,42,"The President and I talked about the situation in Europe in the context of implementing the agreement -- the Helsinki Agreement, the Paris Charter, and especially with regard to the processes taking place in that region, and specifically noted the situation in Yugoslavia, and expressed our position, our understanding, our approach to the resolution of this issue -- a very serious one which worries many of us."
1991-07-31,42,"We're going forward with space cooperation, cooperation in the environment."
1991-07-31,42,We emphasized the necessity of having all sides respect the basic principles indicated in the Helsinki Act and the Paris Charter.
1991-07-31,42,"So, quite a bit has happened between us since Paris."
1991-07-31,42,"I would ask both of you to think back to the 1986 Reykjavik summit when Ronald Reagan horrified quite a few American nuclear experts and almost all of the European leaders by giving serious consideration to your proposal, President Gorbachev, for a ban on all nuclear weapons."
1991-07-31,42,"In the end, Reagan said no because of the belief that nuclear deterrence has, in fact, kept the peace."
1991-07-31,42,Why now are the two of you not saying we will now work towards a total nuclear ban?
1991-07-31,42,Do you still believe in the efficacy of nuclear deterrence in keeping the peace?
1991-07-31,42,"Particularly, sir, I ask you, President Bush, given the fact that some of these breakaway Republics, they have nuclear weapons in there and who knows what would happen if they declare independence."
1991-07-31,42,"The very fact that -- I wouldn't suggest that a breakaway Republic is going to use a nuclear weapon against the United States, but I would suggest that we have every reason in the world to be concerned about renegades -- not in these areas, perhaps; I hope not -- getting hold of nuclear weapons."
1991-07-31,42,"But in my view, other countries do possess nuclear weapons."
1991-07-31,42,The only thing at risk is an errant nuclear missile aiming at a country.
1991-07-31,42,"I think that the argument which you want to ascribe to me, that in my policy I looked upon nuclear weapons as an element of deterrence, is not true."
1991-07-31,42,"We have mapped out a few things for the future, and then there will probably also be questions put to all members of the nuclear club, and they also have to think about what to do with nuclear weapons in the future."
1991-07-31,42,"And finally, we must very carefully act about having the mechanism which we have created and which seems has worked -- but apparently not effectively enough -- about nonproliferation of nuclear weapons."
1991-07-31,42,"For if certain countries will lower their arms and disarm and head in the direction of a nonnuclear world, and at the same time, others will find ways to develop the process in order to have their own nuclear weapons, then we will have a situation which is absurd."
1991-07-31,42,"So, in continuing to support nuclear disarmament and within the framework of the negotiation process, which we have, we have agreed to continue this."
1991-07-31,42,We have the question of truly improving the mechanism of nonproliferation nuclear technology in order -- missile technology -- in order to create an unsurmountable barrier in this area.
1991-07-31,42,"Now I would say the following: We must, within the framework of the documents, the general path mapped out in the Helsinki and the Paris agreements, act in such a way that the old institutions be transformed in the interest of a new Europe so that they serve the interest of a single economic territory, a single security of Europe, a legal aspect."
1974-04-29,2," Third, in the context of the current impeachment climate, I believe all the American people, as well as their representatives in Congress, are entitled to have not only the facts but also the evidence that demonstrates those facts."
1974-04-29,2, We are at last in the process of fulfilling the hope of mankind for a limitation on nuclear arms—a process that will continue when I meet with the Soviet leaders in Moscow in a few weeks.
1975-04-23,5,"It is a state of mind, a melting pot that represents the very, very best of America's evolution, an example of retention of a very special culture in a progressive environment of modern change."
1975-04-23,5, I recognize the need for technology that enriches life while preserving our natural environment.
1975-04-23,5,"My goal is to stimulate productivity, but use technology to redeem, not to destroy our environment."
1975-04-23,5,"I challenge the engineers in this audience to devise new techniques for developing cheap, clean, and plentiful energy, and as a byproduct, to control floods."
1975-04-23,5," The new agenda, that which is developed by you and by us, must place a high priority on the need to stop the spread of nuclear weapons and to work for the mutual reduction in strategic arms and control of other weapons."
2008-10-03,1,It prevents failed executives from receiving windfalls from taxpayers' dollars.
2017-01-10,6,"But the long sweep of America has been defined by forward motion, a constant widening of our founding creed to embrace all and not just some.If I had told you 8 years ago that America would reverse a great recession, reboot our auto industry, and unleash the longest stretch of job creation in our history; if I had told you that we would open up a new chapter with the Cuban people, shut down Iran's nuclear weapons program without firing a shot, take out the mastermind of 9/11; if I had told you that we would win marriage equality and secure the right to health insurance for another 20 million of our fellow citizens—if I had told you all that, you might have said our sights were set a little too high."
2017-01-10,6,Take the challenge of climate change.
2017-01-10,6,"In just 8 years, we've halved our dependence on foreign oil, we've doubled our renewable energy, we've led the world to an agreement that has the promise to save this planet."
2017-01-10,6,"But without bolder action, our children won't have time to debate the existence of climate change."
2017-01-10,6,"They'll be busy dealing with its effects: more environmental disasters, more economic disruptions, waves of climate refugees seeking sanctuary.Now, we can and should argue about the best approach to solve the problem."
2017-01-10,6,"They'll be busy dealing with its effects: more environmental disasters, more economic disruptions, waves of climate refugees seeking sanctuary.Now, we can and should argue about the best approach to solve the problem."
1978-12-15,0,
1990-10-02,0,
1983-03-23,18,"It took one kind of military force to deter an attack when we had far more nuclear weapons than any other power; it takes another kind now that the Soviets, for example, have enough accurate and powerful nuclear weapons to destroy virtually all of our missiles on the ground."
1983-03-23,18,"Well, this is a different world, and our defenses must be based on recognition and awareness of the weaponry possessed by other nations in the nuclear age."
1983-03-23,18,"During the past decade and a half, the Soviets have built up a massive arsenal of new strategic nuclear weapons—weapons that can strike directly at the United States."
1983-03-23,18,"Another example of what's happened: In 1978 the Soviets had 600 intermediate-range nuclear missiles based on land and were beginning to add the SS-20—a new, highly accurate, mobile missile with 3 warheads."
1983-03-23,18,I know too that many of you seriously believe that a nuclear freeze would further the cause of peace.
1983-03-23,18,"At the same time, we're working in the START and INF negotiations with the goal of achieving deep reductions in the strategic and intermediate nuclear arsenals of both sides."
1983-03-23,18,"But since the advent of nuclear weapons, those steps have been increasingly directed toward deterrence of aggression through the promise of retaliation."
1983-03-23,18,We and our allies have succeeded in preventing nuclear war for more than three decades.
1983-03-23,18,"One of the most important contributions we can make is, of course, to lower the level of all arms, and particularly nuclear arms."
1983-03-23,18,"If the Soviet Union will join with us in our effort to achieve major arms reduction, we will have succeeded in stabilizing the nuclear balance."
1983-03-23,18,"And as we proceed, we must remain constant in preserving the nuclear deterrent and maintaining a solid capability for flexible response."
1983-03-23,18,But isn't it worth every investment necessary to free the world from the threat of nuclear war?
1983-03-23,18,"In the meantime, we will continue to pursue real reductions in nuclear arms, negotiating from a position of strength that can be ensured only by modernizing our strategic forces."
1983-03-23,18,"At the same time, we must take steps to reduce the risk of a conventional military conflict escalating to nuclear war by improving our nonnuclear capabilities."
1983-03-23,18,"America does possess—now—the technologies to attain very significant improvements in the effectiveness of our conventional, nonnuclear forces."
1983-03-23,18,"But with these considerations firmly in mind, I call upon the scientific community in our country, those who gave us nuclear weapons, to turn their great talents now to the cause of mankind and world peace, to give us the means of rendering these nuclear weapons impotent and obsolete."
1983-03-23,18,I am directing a comprehensive and intensive effort to define a long-term research and development program to begin to achieve our ultimate goal of eliminating the threat posed by strategic nuclear missiles.
1983-03-23,18,Our only purpose—one all people share—is to search for ways to reduce the danger of nuclear war.
1995-10-16,4,"America, we must clean our house of racism."
1995-10-16,4,"And so I say, we must clean the house of white America of racism."
1995-10-16,4,We must clean our house.
1995-10-16,4,"But to do that, your house, too, must be cleaned of racism."
1988-11-11,0,
2004-01-20,5,"As part of the offensive against terror, we are also confronting the regimes that harbor and support terrorists and could supply them with nuclear, chemical, or biological weapons."
2004-01-20,5,"Last month, the leader of Libya voluntarily pledged to disclose and dismantle all of his regime's weapons of mass destruction programs, including a uranium enrichment project for nuclear weapons."
2004-01-20,5,"Along with nations in the region, we're insisting that North Korea eliminate its nuclear program."
2004-01-20,5,America and the international community are demanding that Iran meet its commitments and not develop nuclear weapons.
2004-01-20,5,"Consumers and businesses need reliable supplies of energy to make our economy run, so I urge you to pass legislation to modernize our electricity system, promote conservation, and make America less dependent on foreign sources of energy."
1981-06-29,1,"Well, there are poor people in this country who should experience just such an elation if they found the economic freedom of a solid job, a productive job—not one concocted by government and dependent on Washington winds; a real job where they could put in a good day's work, complain about the boss, and then go home with confidence and self-respect."
1990-09-11,5,"As I've pointed out before, conservation efforts are essential to keep our energy needs as low as possible."
1990-09-11,5,"And we must then take advantage of our energy sources across the board: coal, natural gas, hydro, and nuclear."
1990-09-11,5,"And we must then take advantage of our energy sources across the board: coal, natural gas, hydro, and nuclear."
1990-09-11,5,"And something else: to curb the proliferation of chemical, biological, ballistic missile and, above all, nuclear technologies."
1990-09-11,5," And third, the Congress should, this month, enact measures to increase domestic energy production and energy conservation in order to reduce dependence on foreign oil."
1989-01-11,5,There are a few favorite windows I have up there that I like to stand and look out of early in the morning.
1989-01-11,5,  I've been thinking a bit at that window.
1989-01-11,5,Not only have the superpowers actually begun to reduce their stockpiles of nuclear weapons—and hope for even more progress is bright—but the regional conflicts that rack the globe are also beginning to cease.
1989-01-11,5,"The past few days when I've been at that window upstairs, I've thought a bit of the ""shining city upon a hill."" The phrase comes from John Winthrop, who wrote it to describe the America he imagined."
1989-01-11,5,"But in my mind it was a tall, proud city built on rocks stronger than oceans, windswept, God-blessed, and teeming with people of all kinds living in harmony and peace; a city with free ports that hummed with commerce and creativity."
