date,climate_sentence_count,climate_sentences
1981-11-18,16,"Rather, it provides a vital link between conventional shorter-range nuclear forces in Europe and intercontinental forces in the United States."
1981-11-18,16,"So, we and our allies are proceeding to modernize NATO's nuclear forces of intermediate range to meet increased Soviet deployments of nuclear systems threatening Western Europe."
1981-11-18,16,The United States proposes the mutual reduction of conventional intermediate-range nuclear and strategic forces.
1981-11-18,16,"As part of the 1979 two-track decision, NATO made a commitment to seek arms control negotiations with the Soviet Union on intermediate range nuclear forces."
1981-11-18,16,"I have informed President Brezhnev that when our delegation travels to the negotiations on intermediate range, land-based nuclear missiles in Geneva on the 30th of this month, my representatives will present the following proposal: The United States is prepared to cancel its deployment of Pershing II and ground-launch cruise missiles if the Soviets will dismantle their SS-20, SS-4, and SS-5 missiles."
1981-11-18,16,"With Soviet agreement, we could together substantially reduce the dread threat of nuclear war which hangs over the people of Europe."
1981-11-18,16,"During the past 6 years while the United States deployed no new intermediate-range missiles and withdrew 1,000 nuclear warheads from Europe, the Soviet Union deployed 750 warheads on mobile, accurate ballistic missiles."
1981-11-18,16,The Soviets assert that a balance of intermediate range nuclear forces already exists.
1981-11-18,16,"Well, as this map demonstrates, the SS-20s, even if deployed behind the Urals, will have a range that puts almost all of Western Europe-the great cities-Rome, Athens, Paris, London, Brussels, Amsterdam, Berlin, and so many more-all of Scandinavia, all of the Middle East, all of northern Africa, all within range of these missiles which, incidentally, are mobile and can be moved on shorter notice."
1981-11-18,16,"Now, I have informed President Brezhnev that we will seek to negotiate substantial reductions in nuclear arms which would result in levels that are equal and verifiable."
2020-01-24,0,
2020-06-13,0,
1981-05-17,0,
2021-09-09,0,
2001-01-20,3,"Now it is a seed upon the wind, taking root in many nations."
2001-01-20,3,"Do you not think an angel rides in the whirlwind and directs this storm?""  Much time has passed since Jefferson arrived for his inauguration."
2001-01-20,3,And an angel still rides in the whirlwind and directs this storm.
2011-05-01,0,
1992-10-11,25,Kids go to bed at night without the same fear of nuclear war.
1992-10-11,25,"So I would say just look at all three of us, decide who you think will do the job, pick that person in November, because, believe me, as I've said before, the party's over, and it's time for the cleanup crew."
1992-10-11,25,We never would have got there if we'd gone for the nuclear-freeze crowd; never would have got there if we'd listened to those that wanted to cut defense spending.
1992-10-11,25,"We've got to clean this mess up, leave this country in good shape, and pass on the American dream to them."
1992-10-11,25,"I want to take every dollar by which we reduced defense and reinvest it in technologies for the 21st century: in new transportation, in communication, and environmental cleanup technologies."
1992-10-11,25,"I want to take every dollar by which we reduced defense and reinvest it in technologies for the 21st century: in new transportation, in communication, and environmental cleanup technologies."
1992-10-11,25,"Step one: You want to put America back to work, clean up the small business problem."
1992-10-11,25,"Have a third task force on new industries of the future to make sure we nail those for our country, and they don't wind up in Europe and Asia."
1992-10-11,25,Our international competitors that are cleaning our plate have an intelligent relationship between Government and business and a supportive relationship.
1992-10-11,25,"Mr. Perot, in the post-cold-war environment, what should be the overriding U.S. national interest?"
1992-10-11,25,"Third, we've got all kinds of agreements on paper and some that are being executed on getting rid of nuclear warheads."
1992-10-11,25,"You've got every rich Middle Eastern country over there trying to buy nuclear weapons, as you well know."
1992-10-11,25,"We've got some agreements on the nuclear, but we don't have those things put away yet."
1992-10-11,25,"Number two, we've got to take care of this missile situation and try to get the nuclear war behind us and give that a very high priority."
1992-10-11,25,"We need to continue the negotiations to reduce nuclear arsenals in the Soviet Union, the former Soviet Union, and the United States."
1992-10-11,25,"And thank God it has, because the parents of these young people around here go to bed at night without the same fear of nuclear war."
1992-10-11,25,We didn't listen to the nuclear freeze crowd.
1992-10-11,25,They rewarded him by opening negotiations with Iran to transfer nuclear technology.
1992-10-11,25,"Mr. President, how can you watch the killing in Bosnia and the ethnic cleansing, or the starvation and anarchy in Somalia, and not want to use America's might, if not America's military, to try to end that kind of suffering?"
1992-10-11,25,I'm concerned about ethnic cleansing.
1992-10-11,25,"I think we have to consider whether or not we should lift the arms embargo now on the Bosnians, since they are in no way in a fair fight with a heavily armed opponent bent on ethnic cleansing."
1992-10-11,25,"But if we sit around blowing all this energy out the window on racial strife and hatred, we are stuck with a sure loser, because we have been a melting pot."
1992-10-11,25,"I saw the winds of hatred divide people and keep the people of my State poorer than they would have been, spiritually and economically."
1992-10-11,25,I think the biggest dividend of making these tough calls is the fact that we are less afraid of nuclear war.
1992-10-11,25,Every parent out there has much less worry that their kids are going to be faced with nuclear holocaust.
2024-01-05,2,"  For the first time on our history, insurrectionists had come to stop the peaceful transfer of power in America — first time — smashing windows, shattering doors, attacking the police."
2024-01-05,2,"  Outside, gallows were erected as the MAGA crowd chanted, “Hang Mike Pence.”Inside, they hunted for Speaker Pelosi [of] the House, was chanting, as they marched through and smashed windows, “Where’s Nancy?”Over 140 police officers were injured."
1990-07-26,1,"The ADA is a dramatic renewal not only for those with disabilities but for all of us, because along with the precious privilege of being an American comes a sacred duty to ensure that every other American's rights are also guaranteed."
1975-05-27,4, The Congress has concentrated its attention on conservation measures such as a higher gasoline tax.
1975-05-27,4,Natural gas production is starting to dwindle.
1975-05-27,4,"Along with it, I will urge the Congress to pass a windfall profits tax with a plowback provision."
1975-05-27,4," These two measures would prevent unfair gains by oil companies from decontrol prices, furnish a substantial incentive to increase domestic energy production, and encourage conservation."
2018-02-23,10,"And we’ve ended the war on beautiful, clean coal."
2018-02-23,10,We knocked out the Paris Climate Accord.
2018-02-23,10,"Russia, they’re allowed to go back into the 1990s, which was not a clean environmental time."
2018-02-23,10,"Russia, they’re allowed to go back into the 1990s, which was not a clean environmental time."
2018-02-23,10,"So, folks, if you don’t mind—I’ll tell you what—it’s amazing how many people understood the Paris Accord, because it sounds so good."
2018-02-23,10,It’s like some of the environmental regulations that I cut—they have the most beautiful titles.
2018-02-23,10,"If you had a puddle on your land, they called it a lake for the purposes of environmentals."
2018-02-23,10,(Applause.) We declined to certify the terrible one-sided Iran nuclear deal.
2018-02-23,10,"Because they’ll sneak in through a window, they’ll sneak in some way."
2018-02-23,10,"And thanks to our massive tax cuts, millions of Americans are getting to keep a great percentage of their money instead of paying it to a government that throws it out the window."
1974-09-16,0,
1975-01-15,16,"Obviously, voluntary conservation continues to be essential, but tougher programs are needed—and needed now."
1975-01-15,16,I urge the Congress to enact a windfall profits tax by that date to ensure that oil producers do not profit unduly.
1975-01-15,16,"The sooner Congress acts, the more effective the oil conservation program will be and the quicker the federal revenues can be returned to our people."
1975-01-15,16,"I want you to know that before deciding on my energy conservation program, I considered rationing and higher gasoline taxes as alternatives."
1975-01-15,16,"It is the intent of this administration to move ahead with exploration, leasing, and production on those frontier areas of the Outer Continental Shelf where the environmental risks are acceptable."
1975-01-15,16,We must strike a reasonable compromise on environmental concerns with coal.
1975-01-15,16,I am submitting Clean Air [Act] amendments which will allow greater coal use without sacrificing clean air goals.
1975-01-15,16,I am proposing a number of actions to energize our nuclear power program.
1975-01-15,16,I will submit legislation to expedite nuclear leasing [licensing] and the rapid selection of sites.
1975-01-15,16,"In recent months, utilities have cancelled or postponed over 60 percent of planned nuclear expansion and 30 percent of planned additions to non-nuclear capacity."
1975-01-15,16,"I therefore propose to the Congress: legislation to make thermal efficiency standards mandatory for all new buildings in the United States; a new tax credit of up to $150 for those homeowners who install insulation equipment; the establishment of an energy conservation program to help low-income families purchase insulation supplies; legislation to modify and defer automotive pollution standards for five years, which will enable us to improve automobile gas mileage by 40 percent by 1980."
1975-01-15,16,"I therefore propose to the Congress: legislation to make thermal efficiency standards mandatory for all new buildings in the United States; a new tax credit of up to $150 for those homeowners who install insulation equipment; the establishment of an energy conservation program to help low-income families purchase insulation supplies; legislation to modify and defer automotive pollution standards for five years, which will enable us to improve automobile gas mileage by 40 percent by 1980."
1975-01-15,16,"Within the next 10 years, my program envisions: 200 major nuclear powerplants; 250 major new coal mines; 150 major coal-fired powerplants; 30 major new [oil] refineries; 20 major new synthetic fuel plants; the drilling of many thousands of new oil wells; the insulation of 18 million homes; and the manufacturing and the sale of millions of new automobiles, trucks, and buses that use much less fuel."
1975-01-15,16,Revenues of some $30 billion from higher energy taxes designed to encourage conservation must be refunded to the American people in a manner which corrects distortions in our tax system wrought by inflation.
1975-01-15,16,"In a world of 150 nations, where nuclear technology is proliferating and regional conflicts continue, international security cannot be taken for granted."
1975-01-15,16,Our relations with the Communist countries are a basic factor of the world environment.
1993-11-13,1,"Yes, the biggest threat that all of us grew up under, communism and nuclear war, communism gone, nuclear war receding."
2019-09-24,6,It is why we in the United States have embarked on an exciting program of national renewal.
2019-09-24,6,At the center of our vision for national renewal is an ambitious campaign to reform international trade.
2019-09-24,6,"At the same time, the regime is squandering the nation’s wealth and future in a fanatical quest for nuclear weapons and the means to deliver them."
2019-09-24,6,"To stop Iran’s path to nuclear weapons and missiles, I withdrew the United States from the terrible Iran nuclear deal, which has very little time remaining, did not allow inspection of important sites, and did not cover ballistic missiles."
2019-09-24,6,"I have told Kim Jong Un what I truly believe: that, like Iran, his country is full of tremendous untapped potential, but that to realize that promise, North Korea must denuclearize."
2019-09-24,6,"Mass illegal migration is unfair, unsafe, and unsustainable for everyone involved: the sending countries and the depleted countries."
1993-12-08,7," I do want to say, also, a special word of thanks to all the citizens who helped us, the business leaders, the labor folks, the environmental people who came out and worked through this-many of them at great criticism, particularly in the environmental movement—and some of the working people who helped it."
1993-12-08,7," I believe we have made a decision now that will permit us to create an economic order in the world that will promote more growth, more equality, better preservation of the environment, and a greater possibility of world peace."
1993-12-08,7,The environmental and labor side agreements negotiated by our administration will make this agreement a force for social progress as well as economic growth.
1993-12-08,7,But for too many those same winds of change have worn away at file basis of their security.
1993-12-08,7,"The United States must seek nothing less than a new trading system that benefits all nations through robust commerce but that protects our middle class and gives other nations a chance to grow one, that lifts workers and the environment up without dragging people down, that seeks to ensure that our policies reflect our values."
1993-12-08,7,We are determining that dynamic trade cannot lead to environmental despoliation.
1993-12-08,7,We will seek new institutional arrangements to ensure that trade leaves the world cleaner than before.
1989-02-09,15," If we're to protect our future, we need a new attitude about the environment."
1989-02-09,15,"It will include a plan to reduce by date certain the emissions which cause acid rain, because the time for study alone has passed, and the time for action is now."
1989-02-09,15,We must make use of clean coal.
1989-02-09,15,"My budget contains full funding, on schedule, for the clean coal technology agreement that we've made with Canada."
1989-02-09,15,But we must use caution; we must respect the environment.
1989-02-09,15,Action on these three lease sales will await the conclusion of a special task force set up to measure the potential for environmental damage.
1989-02-09,15,I want faster cleanups and tougher enforcement of penalties against polluters.
1989-02-09,15, We face a massive task in cleaning up the waste left from decades of environmental neglect at America's nuclear weapons plants.
1989-02-09,15, We face a massive task in cleaning up the waste left from decades of environmental neglect at America's nuclear weapons plants.
1989-02-09,15, We face a massive task in cleaning up the waste left from decades of environmental neglect at America's nuclear weapons plants.
1989-02-09,15,"But beyond that, we must clean up the old mess that's been left behind."
1989-02-09,15,"This will allow us to identify the exact nature of the various problems so we can clean them up, and clean them up we will."
1989-02-09,15,And the spread of nuclear weapons must be stopped.
1989-02-09,15,Our diplomacy must work every day against the proliferation of nuclear weapons.
1989-02-09,15," And I, too, shall begin a trip shortly to the far reaches of the Pacific Basin, where the winds of democracy are creating new hope and the power of free markets is unleashing a new force."
1992-01-28,4,"And they won't have, as my children did, air raid drills in which they crawl under their desks and cover their heads in case of nuclear war."
1992-01-28,4,Tonight I can tell you of dramatic changes in our strategic nuclear force.
1992-01-28,4,I remind you this evening that I have asked for your support in funding a program to protect our country from limited nuclear missile attack.
1992-01-28,4,We must have this protection because too many people in too many countries have access to nuclear arms.
2020-10-26,0,
1986-04-14,0,
2001-09-22,1,"America will never forget the sounds of our National Anthem playing at Buckingham Palace, on the streets of Paris, and at Berlin's Brandenburg Gate."
1988-05-31,4,"Perhaps most exciting are the winds of change that are blowing over the People's Republic of China, where one-quarter of the world's population is now getting its first taste of economic freedom."
1988-05-31,4,"The INF treaty, which General Secretary Gorbachev and I signed last December in Washington and whose instruments of ratification we will exchange tomorrow—the first true nuclear arms reduction treaty in history, calling for the elimination of an entire class of U.S. and Soviet nuclear missiles."
1988-05-31,4,"In this Moscow spring, this May 1988, we may be allowed that hope: that freedom, like the fresh green sapling planted over Tolstoy's grave, will blossom forth at last in the rich fertile soil of your people and culture."
1988-05-31,4,"My dream has always been that once we've started down this road, we can look forward to a day—you can look forward to a day—when there will be no more nuclear weapons in the world at all."
1989-01-20,1," A President is neither prince nor pope, and I don't seek a window on men's souls."
1999-03-24,1," Hopefully, Mr. Milosevic will realize his present course is self-destructive and unsustainable."
2011-01-25,18," I’ve seen it in the shuttered windows of once booming factories, and the vacant storefronts on once busy Main Streets."
2011-01-25,18,I’ve heard it in the frustrations of Americans who’ve seen their paychecks dwindle or their jobs disappear -– proud men and women who feel like the rules have been changed in the middle of the game.
2011-01-25,18," Just recently, China became the home to the world’s largest private solar research facility, and the world’s fastest computer."
2011-01-25,18," We’ll invest in biomedical research, information technology, and especially clean energy technology -– (applause) -- an investment that will strengthen our security, protect our planet, and create countless new jobs for our people."
2011-01-25,18,"        Already, we’re seeing the promise of renewable energy."
2011-01-25,18," Today, with the help of a government loan, that empty space is being used to manufacture solar shingles that are being sold all across the country."
2011-01-25,18," We’re telling America’s scientists and engineers that if they assemble teams of the best minds in their fields, and focus on the hardest problems in clean energy, we’ll fund the Apollo projects of our time."
2011-01-25,18," At Oak Ridge National Laboratory, they’re using supercomputers to get a lot more power out of our nuclear facilities."
2011-01-25,18,"        Now, clean energy breakthroughs will only translate into clean energy jobs if businesses know there will be a market for what they’re selling."
2011-01-25,18," So tonight, I challenge you to join me in setting a new goal:  By 2035, 80 percent of America’s electricity will come from clean energy sources."
2011-01-25,18, (Applause.)         Some folks want wind and solar.
2011-01-25,18, (Applause.)         Some folks want wind and solar.
2011-01-25,18," Others want nuclear, clean coal and natural gas."
2011-01-25,18," Others want nuclear, clean coal and natural gas."
2011-01-25,18, That is not sustainable.
2011-01-25,18," Because Republicans and Democrats approved the New START treaty, far fewer nuclear weapons and launchers will be deployed."
2011-01-25,18," Because we rallied the world, nuclear materials are being locked down on every continent so they never fall into the hands of terrorists."
2011-01-25,18," And on the Korean Peninsula, we stand with our ally South Korea, and insist that North Korea keeps its commitment to abandon nuclear weapons."
1979-11-13,3,"We must also have wider use of nuclear power within strict safety rules, of course."
1979-11-13,3,In years to come solar energy may provide much of the answer but for the next two or three decades we must do such things as master the chemistry of coal.
1979-11-13,3,"During a time when the Soviet Union may enjoy nuclear superiority over this country, we must never waiver in our commitment to our allies nor accept any negotiation which is not clearly in the national interest."
1993-10-07,2,Our troops created a secure environment so that food and medicine could get through.
1993-10-07,2,"While we're taking military steps to protect our own people and to help the U.N. maintain a secure environment, we must pursue new diplomatic efforts to help the Somalis find a political solution to their problems."
1980-07-17,4,But conservation is not the sole answer to our energy needs.
1980-07-17,4,So does nuclear energy produced under rigorous safety standards.
1980-07-17,4,"We will not permit the safety of our people or our environment heritage to be jeopardized, but we are going to reaffirm that the economic prosperity of our people is a fundamental part of our environment."
1980-07-17,4,We are awed--and rightly so--by the forces of destruction at loose in the world in this nuclear era.
2007-01-23,13,Extending hope and opportunity depends on a stable supply of energy that keeps America's economy running and America's environment clean.
2007-01-23,13,Extending hope and opportunity depends on a stable supply of energy that keeps America's economy running and America's environment clean.
2007-01-23,13,"We must continue changing the way America generates electric power by even greater use of clean coal technology, solar and wind energy, and clean, safe nuclear power."
2007-01-23,13,"We must continue changing the way America generates electric power by even greater use of clean coal technology, solar and wind energy, and clean, safe nuclear power."
2007-01-23,13,"We must continue changing the way America generates electric power by even greater use of clean coal technology, solar and wind energy, and clean, safe nuclear power."
2007-01-23,13,"We must continue changing the way America generates electric power by even greater use of clean coal technology, solar and wind energy, and clean, safe nuclear power."
2007-01-23,13,We need to press on with battery research for plug-in and hybrid vehicles and expand the use of clean diesel vehicles and biodiesel fuel.
2007-01-23,13,"To reach this goal, we must increase the supply of alternative fuels by setting a mandatory fuels standard to require 35 billion gallons of renewable and alternative fuels in 2017—and that is nearly five times the current target."
2007-01-23,13,"And so as we continue to diversify our fuel supply, we must step up domestic oil production in environmentally sensitive ways."
2007-01-23,13,"And these technologies will help us be better stewards of the environment, and they will help us to confront the serious challenge of global climate change."
2007-01-23,13,"And these technologies will help us be better stewards of the environment, and they will help us to confront the serious challenge of global climate change."
2007-01-23,13,The United Nations has imposed sanctions on Iran and made it clear that the world will not allow the regime in Tehran to acquire nuclear weapons.
2007-01-23,13,"Together with our partners in China and Japan, Russia and South Korea, we're pursuing intensive diplomacy to achieve a Korean Peninsula free of nuclear weapons."
2011-05-19,6, Satellite television and the Internet provide a window into the wider world -– a world of astonishing progress in places like India and Indonesia and Brazil.
2011-05-19,6," For decades, the United States has pursued a set of core interests in the region:  countering terrorism and stopping the spread of nuclear weapons; securing the free flow of commerce and safe-guarding the security of the region; standing up for Israel’s security and pursuing Arab-Israeli peace."
2011-05-19,6," We believe that no one benefits from a nuclear arms race in the region, or al Qaeda’s brutal attacks."
2011-05-19,6, The status quo is not sustainable.
2011-05-19,6,"Now, our opposition to Iran’s intolerance and Iran’s repressive measures, as well as its illicit nuclear program and its support of terror, is well known."
2011-05-19,6," But precisely because of our friendship, it’s important that we tell the truth:  The status quo is unsustainable, and Israel too must act boldly to advance a lasting peace."
1995-04-23,1,Those who trouble their own house will inherit the wind.
2017-07-24,1,"And he’d build homes, and at night he’d go to these major sites with teams of people, and he’d scour the sites for nails, and sawdust and small pieces of wood, and they cleaned the site, so when the workers came in the next morning, the sites would be spotless and clean, and he did it properly."
2008-03-19,1,"Iran would be emboldened as well, with a renewed determination to develop nuclear weapons and impose its brand of hegemony across the Middle East."
2013-02-13,19," (Applause.)  We have doubled the distance our cars will go on a gallon of gas, and the amount of renewable energy we generate from sources like wind and solar -- with tens of thousands of good American jobs to show for it."
