date,climate_sentence_count,climate_sentences
2021-07-08,1,We need to take concerted action to fight existential threats of climate change.
1977-01-20,1,And we will move this year a step toward ultimate goal--the elimination of all nuclear weapons from this Earth.
2011-09-08,2," It will put people to work right now fixing roofs and windows, installing science labs and high-speed Internet in classrooms all across this country."
2011-09-08,2," (Applause.)  We shouldn’t be in a race to the bottom, where we try to offer the cheapest labor and the worst pollution standards."
1983-04-27,1,"Only last week, an official of the Soviet Union reiterated Brezhnev's threat to station nuclear missiles in this hemisphere, 5 minutes from the United States."
1996-11-03,3, We're seeing a deeper sense of community—trying to preserve our natural environment for our children and our grandchildren.
1996-11-03,3," We know that we're breaking down the frontiers of ignorance in so many ways that will help us to cure cancer, that will help us to find ways to grow our economy while we improve our environment, that will help us to find ways to create jobs for people who have never been able to get them before."
1996-11-03,3,And think what a blessing it is that you are anchored in what you believe and that you are not subject to the wild winds that often blow through the airwaves at election time.
1984-05-28,0,
1980-10-28,41,"One is to control nuclear weapons, which I hope we'll get to later on, because that's the most important single issue in this campaign."
1980-10-28,41,"Also, the new energy policy has been predicated on two factors: One, conservation, which requires sacrifice, and the other one, increase in production of American energy, which is going along very well — more coal this year than ever before in history, more oil and gas wells drilled this year than ever before in history."
1980-10-28,41,"It looks like a bombed-out city — great, gaunt skeletons of buildings, windows smashed out, painted on one of them ""Unkept promises,"" on another, ""Despair."" And this was the spot at which President Carter had promised that he was going to bring in a vast program to rebuild this area."
1980-10-28,41,"We initiated a very fine urban renewal program, working with the mayors, the Governors, and other interested officials."
1980-10-28,41,"Under the windfall profits tax, we expect to spend about $43 billion in the next 10 years to rebuild the transportation systems of our country."
1980-10-28,41,"There is no doubt in my mind that in the downtown, central cities, with the new commitment on an energy policy, with a chance to revitalize homes and to make them more fuel-efficient, with a chance for a synthetic fuels program, solar power, this will give us an additional opportunity for jobs which will pay rich dividends."
1980-10-28,41,Both I and all my predecessors have had a deep commitment to controlling the proliferation of nuclear weapons in countries like Libya or Iraq.
1980-10-28,41,"We have even alienated some of our closest trade partners, because we have insisted upon the control of the spread of nuclear weapons to those potentially terrorist countries."
1980-10-28,41,"When Governor Reagan has been asked about that, he makes a very disturbing comment that nonproliferation, or the control of the spread of nuclear weapons, is none of our business."
1980-10-28,41,"Secondly, we all committed ourselves, as have all my predecessors in the Oval Office, not to permit the spread of nuclear weapons to a terrorist nation or to any other nation that does not presently have those weapons or capabilities for explosives."
1980-10-28,41,"I have never made the statement that he suggested about nuclear proliferation, and nuclear proliferation, or the trying to halt it, would be a major part of a foreign policy of mine."
1980-10-28,41,"Governor Reagan, arms control: The President said it was the single most important issue, Both of you have expressed the desire to end the nuclear arms race with Russia, but by methods that are vastly different."
1980-10-28,41,"The SALT II treaty was the result of negotiations that Mr. Carter's team entered into after he had asked the Soviet Union for a discussion of actual reduction of nuclear strategic weapons, and his emissary, I think, came home in 12 hours having heard a very definite yet."
1980-10-28,41,"Both of you have expressed the desire to end the nuclear arms race with Russia, but through vastly different methods."
1980-10-28,41,"Inflation, unemployment, the cities-all very important issues, but they pale into insignificance in the life and duties of a President when compared with the control of nuclear weapons."
1980-10-28,41,"Every President who has served in the Oval Office since Harry Truman has been dedicated to the proposition of controlling nuclear weapons, to negotiate with the Soviet Union — balanced, controlled, observable, and then reducing levels of atomic weaponry."
1980-10-28,41,"He has never supported any of those arms control agreements — the limited test ban, SALT I, nor the antiballistic missile treaty, nor the Vladivostok Treaty negotiated with the Soviet Union by President Ford — and now he wants to throw into the wastebasket a treaty to control nuclear weapons on a balanced and equal basis between ourselves and the Soviet Union, negotiated over a 7-year period, by myself and my two Republican predecessors."
1980-10-28,41,"And I would say to the Soviet Union, we will sit and negotiate with you as long as it takes, to have not only legitimate arms limitation but to have a reduction of these nuclear weapons to the point that neither one of us represents a threat to the other."
1980-10-28,41,He not only advocates the scrapping of this treaty — and I don't know that these men that he quotes are against the treaty in its final form — but he also advocates the possibility-he said it's been a missing element-of playing a trump card against the Soviet Union of a nuclear arms race and insisting upon nuclear superiority by our own Nation as a predication for negotiation in the future with the Soviet Union.
1980-10-28,41,"If President Brezhnev said, ""We will scrap this treaty, negotiated under three American presidents over a 7-year period of time; we insist upon nuclear superiority as a basis for future negotiations; and we believe that the launching of a nuclear arms race is a good basis for future negotiations,"" it's obvious that I, as President, and all Americans would reject such a proposition."
1980-10-28,41,This would mean the resumption of a very dangerous nuclear arms race.
1980-10-28,41,"It would change the basic tone and commitment that our Nation has experienced ever since the Second World War, with all Presidents, Democratic and Republican, and would also be very disturbing to our allies, all of whom support this nuclear arms treaty."
1980-10-28,41,"It does not call for nuclear superiority on the part of the United States; it calls for a mutual reduction of these weapons, as I say, that neither of us can represent a threat to the other."
1980-10-28,41,She said she thought nuclear weaponry and the control of nuclear arms.
1980-10-28,41,"Mr. President, as you have said, Americans, through conservation, are importing much less oil today than we were even a year ago."
1980-10-28,41,"Can the United States develop synthetic fuels and other alternative energy sources without damage to the environment, and will this process mean steadily higher fuel bills for American families?"
1980-10-28,41,"This commitment has been opening up a very bright vista for our Nation in the future, because with the windfall profits tax as a base, we now have an opportunity to use American technology and American ability and American natural resources to expand rapidly the production of synthetic fuels, yes; to expand rapidly the production of solar energy, yes; and also to produce the conventional kinds of American energy."
1980-10-28,41,"This commitment has been opening up a very bright vista for our Nation in the future, because with the windfall profits tax as a base, we now have an opportunity to use American technology and American ability and American natural resources to expand rapidly the production of synthetic fuels, yes; to expand rapidly the production of solar energy, yes; and also to produce the conventional kinds of American energy."
1980-10-28,41,"Governor Reagan, Americans, through conservation, are importing much less oil today than we were even a year ago."
1980-10-28,41,"The question is whether the development of alternative energy sources, in order to reduce this dependence, can be done without damaging the environment, and will it mean for American families steadily higher fuel bills?"
1980-10-28,41,"But 32 of those have given up and canceled their plans to build, and again, because Government regulations and permits and so forth make it take more than twice as long to build a nuclear plant in the United States as it does to build one in Japan or in Western Europe."
1980-10-28,41,"We have a chance in the next 15 years, insisting upon the health and safety of workers in the mines, and also preserving the same high air and water pollution standards, to triple the amount of coal we produce."
1980-10-28,41,"Governor Reagan's approach to our energy policy, which has already proven its effectiveness, is to repeal or to change substantially the windfall profits tax, to return a major portion of $227 billion back to the oil companies, to do away with the Department of Energy, to shortcircuit our synthetic fuels program, to put a minimal emphasis on solar power, to emphasize strongly nuclear powerplants as a major source of energy in the future."
1980-10-28,41,"Governor Reagan's approach to our energy policy, which has already proven its effectiveness, is to repeal or to change substantially the windfall profits tax, to return a major portion of $227 billion back to the oil companies, to do away with the Department of Energy, to shortcircuit our synthetic fuels program, to put a minimal emphasis on solar power, to emphasize strongly nuclear powerplants as a major source of energy in the future."
1980-10-28,41,"Governor Reagan's approach to our energy policy, which has already proven its effectiveness, is to repeal or to change substantially the windfall profits tax, to return a major portion of $227 billion back to the oil companies, to do away with the Department of Energy, to shortcircuit our synthetic fuels program, to put a minimal emphasis on solar power, to emphasize strongly nuclear powerplants as a major source of energy in the future."
1980-10-28,41,"And for Mr. Carter to suggest that I want to do away with the safety laws and with the laws that pertain to clean water and clean air, and so forth as Governor of California, I took charge of passing the strictest air pollution laws in the United States — the strictest air quality law that has ever been adopted in the United States."
1980-10-28,41,"And for Mr. Carter to suggest that I want to do away with the safety laws and with the laws that pertain to clean water and clean air, and so forth as Governor of California, I took charge of passing the strictest air pollution laws in the United States — the strictest air quality law that has ever been adopted in the United States."
1980-10-28,41,"As a matter of fact, the air pollution standard laws that were passed in California were passed over the objections of Governor Reagan, and this is a very well known fact."
1980-10-28,41,"If it is a wellknown fact that I opposed air pollution laws in California, the only thing I can possibly think of is that the President must be suggesting the law that the Federal Government tried to impose on the State of California — not a law, regulations that would have made it impossible to drive an automobile within the city limits of any California city, or have a place to put it if you did drive it against their regulations."
1980-10-28,41,We still have the strictest air control or air pollution laws in the country.
1980-10-28,41,"The most important crucial difference in this election campaign, in my judgment, is the approach to the control of nuclear weaponry and the inclination to control or not to control the spread of atomic weapons to other nations that don't presently have it, particularly the terrorist nations."
1999-01-19,13,"Thanks to the pioneering leadership of all of you, we have the lowest violent crime rate in a quarter century and the cleanest environment in a quarter century."
1999-01-19,13,"Thanks to the pioneering leadership of all of you, we have the lowest violent crime rate in a quarter century and the cleanest environment in a quarter century."
1999-01-19,13,Somehow we have to find a common ground on which business and workers and environmentalists and farmers and government can stand together.
1999-01-19,13,"But at the same time, we must ensure that ordinary citizens in all countries actually benefit from trade, a trade that promotes the dignity of work and the rights of workers and protects the environment."
1999-01-19,13,"We must increase our efforts to restrain the spread of nuclear weapons and missiles, from Korea to India and Pakistan."
1999-01-19,13,"We must expand our work with Russia, Ukraine, and other former Soviet nations to safeguard nuclear materials and technology so they never fall into the wrong hands."
1999-01-19,13,"With Russia, we must continue to reduce our nuclear arsenals."
1999-01-19,13,"I ask the Senate to take this vital step: Approve the treaty now, to make it harder for other nations to develop nuclear arms, and to make sure we can end nuclear testing forever."
1999-01-19,13,"Tonight I propose a new clean air fund to help communities reduce greenhouse and other pollution, and tax incentives and investments to spur clean energy technology."
1999-01-19,13,"Tonight I propose a new clean air fund to help communities reduce greenhouse and other pollution, and tax incentives and investments to spur clean energy technology."
1999-01-19,13,"Tonight I propose a new clean air fund to help communities reduce greenhouse and other pollution, and tax incentives and investments to spur clean energy technology."
1999-01-19,13,"And I want to work with members of Congress in both parties to reward companies that take early, voluntary action to reduce greenhouse gases."
1999-01-19,13,"All our communities face a preservation challenge, as they grow and green space shrinks."
1982-09-01,1,"In an age of nuclear challenge and economic interdependence, such conflicts are a threat to all the people of the world, not just the Middle East itself."
2009-01-12,8,I'm for a sustainable cease-fire.
2009-01-12,8,And a definition of a sustainable cease-fire is that Hamas stops firing rockets into Israel.
2009-01-12,8,And there will not be a sustainable cease-fire if they continue firing rockets.
2009-01-12,8,And we believe that the best way to ensure that there is a sustainable cease-fire is to work with Egypt to stop the smuggling of arms into the Gaza that enables Hamas to continue to fire rockets.
2009-01-12,8,"Hamas, obviously, if they're interested in a sustainable cease-fire, needs to stop arming."
2009-01-12,8,Do you remember what the environment was like in Washington?
2009-01-12,8,Q -- economic environment.
2009-01-12,8,"I worry about people looking at our system and saying, why would I want to go up there and work in that kind of environment?"
2016-03-22,3,"The next year, the entire world held its breath, watching our two countries, as humanity came as close as we ever have to the horror of nuclear war."
2016-03-22,3," And I can tell you as a friend that sustainable prosperity in the 21st century depends upon education, health care, and environmental protection."
2016-03-22,3," And I can tell you as a friend that sustainable prosperity in the 21st century depends upon education, health care, and environmental protection."
2005-02-02,10,"To keep our economy growing, we also need reliable supplies of affordable, environmentally responsible energy."
2005-02-02,10,"Nearly four years ago, I submitted a comprehensive energy strategy that encourages conservation, alternative sources, a modernized electricity grid, and more production here at home, including safe, clean nuclear energy."
2005-02-02,10,"Nearly four years ago, I submitted a comprehensive energy strategy that encourages conservation, alternative sources, a modernized electricity grid, and more production here at home, including safe, clean nuclear energy."
2005-02-02,10,"Nearly four years ago, I submitted a comprehensive energy strategy that encourages conservation, alternative sources, a modernized electricity grid, and more production here at home, including safe, clean nuclear energy."
2005-02-02,10,My Clear Skies legislation will cut power plant pollution and improve the health of our citizens.
2005-02-02,10,"And my budget provides strong funding for leading-edge technology—from hydrogen-fueled cars, to clean coal, to renewable sources such as ethanol."
2005-02-02,10,"And my budget provides strong funding for leading-edge technology—from hydrogen-fueled cars, to clean coal, to renewable sources such as ethanol."
2005-02-02,10,"And my budget provides strong funding for leading-edge technology—from hydrogen-fueled cars, to clean coal, to renewable sources such as ethanol."
2005-02-02,10,We are working closely with governments in Asia to convince North Korea to abandon its nuclear ambitions.
2005-02-02,10,"Today, Iran remains the world's primary state sponsor of terror—pursuing nuclear weapons while depriving its people of the freedom they seek and deserve."
1995-01-24,6,"But when we deregulate, let's remember what national action in the national interest has given us: safer food for our families, safer toys for our children, safer nursing homes for our parents, safer cars and highways, and safer workplaces, cleaner air, and cleaner water."
1995-01-24,6,"We can have fairness and still clean up toxic dumps, and we ought to do it."
1995-01-24,6,"And along with the Russians, we're on our way to destroying the missiles and the bombers that carry 9,000 nuclear warheads."
1995-01-24,6,We've come so far so fast in this post-Cold-War world that it's easy to take the decline of the nuclear threat for granted.
1995-01-24,6,"The United States will lead the charge to extend indefinitely the Nuclear Non-Proliferation Treaty, to enact a comprehensive nuclear test ban, and to eliminate chemical weapons."
1995-01-24,6,"To stop and roll back North Korea's potentially deadly nuclear program, we'll continue to implement the agreement we have reached with that nation."
1993-09-22,3,"Any doctor who deals with the elderly will tell you that there are many elderly people who don't get medicine, who get sicker and sicker and eventually go to the doctor and wind up spending more money and draining more money from the health care system than they would if they had regular treatment in the way that only adequate medicine can provide."
1993-09-22,3,But we passed a budget which has Medicaid increases of between 16 and 11 percent a year over the next 5 years and Medicare increases of between 11 and 9 percent in an environment where we assume inflation will be at 4 percent or less.
1993-09-22,3,"Why should the rest of us pick up the tab when a guy who doesn't think he needs insurance or says he can't afford it gets in an accident, winds up in an emergency room, gets good care, and everybody else pays?"
1992-12-15,7,"By the 1980's, Kremlin leaders found that our alliance would not crack when they threatened America's allies with the infamous SS-20 nuclear missile."
1992-12-15,7," The free peoples of the world watched; they watched in awe as the Soviet Union collapsed, but they held their breath at what might take its place, wondering who might control its tens of thousands of nuclear weapons."
1992-12-15,7,"I ask them to consider the last 4 years when a dozen dreams were made real: The Berlin Wall demolished and Germany united; the captive nations set free; Russia democratic; whole classes of nuclear weapons eliminated, the rest vastly reduced; many nations united in our historic U.N. coalition to turn back a tyrant in the Persian Gulf; Israel and its Arab neighbors for the first time talking peace, face to face, in a region that has known so much war."
1992-12-15,7,"Investment, free trade, debt relief, and environmental protection will nurture the homegrown reforms throughout Latin America."
1992-12-15,7,We've strengthened multilateral export controls on nuclear and chemical and biological and missile-related technologies.
1992-12-15,7,"And once implemented, the agreements we've negotiated will ban new nuclear states on the territory of the former Soviet Union."
1992-12-15,7,"And above all, we've sought to erase nuclear nightmares from the sleep of future generations."
1985-11-21,11,And may I add that we were especially eager that our meetings give a push to important talks already underway on reducing nuclear weapons.
1985-11-21,11, We discussed nuclear arms and how to reduce them.
1985-11-21,11," Specifically, we agreed in Geneva that each side should move to cut offensive nuclear arms by 50 percent in appropriate categories."
1985-11-21,11,"We called for an interim accord on intermediate-range nuclear forces, leading, I hope, to the complete elimination of this class of missiles—and all of this with tough verification."
1985-11-21,11,"We also made progress in combating, together, the spread of nuclear weapons, an arms control area in which we've cooperated effectively over the years."
1985-11-21,11," I described our Strategic Defense Initiative, our research effort, that envisions the possibility of defensive systems which could ultimately protect all nations against the danger of nuclear war."
1985-11-21,11,Mr. Gorbachev insisted that we might use a strategic defense system to put offensive weapons into space and establish nuclear superiority.
1985-11-21,11,"I made it clear that SDI has nothing to do with offensive weapons; that, instead, we are investigating nonnuclear defense systems that would only threaten offensive missiles, not people."
1985-11-21,11,We don't seek nuclear superiority.
1985-11-21,11,"This is why we've proposed a 50-percent reduction in the most threatening nuclear weapons, especially those that could carry out a first strike."
1985-11-21,11,"I promised that if our research reveals that a defense against nuclear missiles is possible, we would sit down with our allies and the Soviet Union to see how together we could replace all strategic ballistic missiles with such a defense, which threatens no one."
2010-03-15,2, So the bottom line is this:  The status quo on health care is simply unsustainable.
2010-03-15,2, They don’t want us putting our finger out to the wind.
2018-09-25,8,"In June, I traveled to Singapore to meet face to face with North Korea’s leader, Chairman Kim Jong Un. We had highly productive conversations and meetings, and we agreed that it was in both countries’ interest to pursue the denuclearization of the Korean Peninsula."
2018-09-25,8,The sanctions will stay in place until denuclearization occurs.
2018-09-25,8,That is why so many countries in the Middle East strongly supported my decision to withdraw the United States from the horrible 2015 Iran Nuclear Deal and re-impose nuclear sanctions.
2018-09-25,8,The Iran deal was a windfall for Iran’s leaders.
2018-09-25,8,"The dictatorship used the funds to build nuclear-capable missiles, increase internal repression, finance terrorism, and fund havoc and slaughter in Syria and Yemen."
2018-09-25,8,"Last month, we began re-imposing hard-hitting nuclear sanctions that had been lifted under the Iran deal."
2018-09-25,8,"We cannot allow a regime that chants “Death to America,” and that threatens Israel with annihilation, to possess the means to deliver a nuclear warhead to any city on Earth."
2018-09-25,8,"The United States stands ready to export our abundant, affordable supply of oil, clean coal, and natural gas."
1988-09-26,9,"And another change, Mr. Secretary-General, a change that, if it endures, may go down as one of the signal accomplishments of our history, a change that is a cause for shaking of the head in wonder, is also upon us—a change going to the source of postwar tensions and to the once seemingly impossible dream of ending the twin threats of our time: totalitarianism and thermonuclear world war."
1988-09-26,9,"And these negotiations, some of them under U.N. auspices, involve a broad arms control agenda—strategic offensive weapons and space, nuclear testing and chemical warfare—whose urgency we have witnessed anew in recent days."
1988-09-26,9,"Only recently, when the United States and the Soviet Union signed the INF agreement, an entire class of U.S. and Soviet nuclear missiles was eliminated for the first time in history."
1988-09-26,9,"Even on the arms control issue itself, we agreed to go beyond the past, to seek not just treaties that permit building weapons to higher levels but revolutionary agreements that actually reduced and even eliminated a whole class of nuclear weapons."
1988-09-26,9,"Indeed, the invasion of Afghanistan and the apparent will among democratic and peace-loving nations to deter such events seemed to cause a climate where aggression by nations large and small was epidemic, a climate the world has not seen since the 1930's."
1988-09-26,9,"So, too, our discussions on nuclear testing and defense and space have been useful."
1988-09-26,9,"But let me here stress to this General Assembly that much of the momentum in nuclear arms control negotiations is due to technological progress itself, especially in the potential for space-based defensive systems."
